source,correction,domain
"Хронические заболевания в анамнезе  : хроническая обструктивная болезнь легких; ОНМК: 2001 году ( выписки нет)      Аллергологический анамнез   : не отягощен    Вредные привычки:  курение 1 пачка в день, около 40 лет","Хронические заболевания в анамнезе  : хроническая обструктивная болезнь лёгких; ОНМК: 2001 году ( выписки нет)      Аллергологический анамнез   : не отягощён    Вредные привычки:  курение 1 пачка в день, около 40 лет",MedSpellChecker
"Аллергологический анамнез   : не отягощен      Эпиданамнез   : Гепатит, туберкулез, малярию, венерические заболевания -отрицает: Гемотрансфузии: отрицает   Постоянный прием медикаментов: нет    Вредные привычки:  курение 1 пачка в день в течение 30 лет","Аллергологический анамнез: не отягощён. Эпиданамнез: гепатит, туберкулёз, малярию, венерические заболевания – отрицает: гемотрансфузии: отрицает. Постоянный приём медикаментов: нет. Вредные привычки: курение 1 пачка в день в течение 30 лет",MedSpellChecker
"ранее курил, бросил в 2007г","ранее курил, бросил в 2007 г",MedSpellChecker
Гемитиреоидэктомия от 2006г,Гемитиреоидэктомия от 2006 г.,MedSpellChecker
Со слов перенес в детском возрасте ревматизм,Со слов перенёс в детском возрасте ревматизм,MedSpellChecker
"медикаменты пенициллин, хлористый кальций; АЛЛЕРГИИ НА ЙОД НЕТ    Вредные привычки:  отрицает","медикаменты пенициллин, хлористый кальций; АЛЛЕРГИИ НА ЙОД НЕТ. Вредные привычки: отрицает.",MedSpellChecker
хроническая обструктивная болезнь легких иное Синдром Рейно верхних и нижних конечностей,"хроническая обструктивная болезнь лёгких, иное: Синдром Рейно верхних и нижних конечностей",MedSpellChecker
Наследственность:  заболевания у родственников одна здорова,Наследственность:  заболевания у родственников одна здорова,MedSpellChecker
Родился и живет в Кемеровской области,Родился и живёт в Кемеровской области,MedSpellChecker
"Туберкулез, сифилис, малярию отрицает","Туберкулёз, сифилис, малярию отрицает",MedSpellChecker
Перенесенное ОНМК неизвесной давности в б.ПСМА,Перенесённое ОНМК неизвестной давности в б.ПСМА,MedSpellChecker
Работал командиром в охранном оделении,Работал командиром в охранном отделении,MedSpellChecker
Более 12 лет страдает сахарным диабетом 2 типа,Более 12 лет страдает сахарным диабетом 2 типа,MedSpellChecker
ЖКБ; хронический холецистит   Наследственность:  не отягощена   Страховой анамнез:  не работает   Аллергологический анамнез  : без особенностей   Вредные привычки:  курение менее 1 пачки в день; алкоголь умеренно,ЖКБ; хронический холецистит   Наследственность:  не отягощена   Страховой анамнез:  не работает   Аллергологический анамнез  : без особенностей   Вредные привычки:  курение менее 1 пачки в день; алкоголь умеренно,MedSpellChecker
полип мочевого пузыря,полип мочевого пузыря,MedSpellChecker
курит в течение 40 лет по 1 пачке в день,курит в течение 40 лет по 1 пачке в день,MedSpellChecker
"В анамнезе - ХОБЛ легкой степени тяжести, хронический пиелонефрит, псориаз","В анамнезе - ХОБЛ лёгкой степени тяжести, хронический пиелонефрит, псориаз",MedSpellChecker
"Наследственность: у отца ИМ  Страховой анамнез: работает, б/л с 28.09.11  Аллергологический анамнез: не отмечал  Вредные привычки курит 10 лет по 2-3 сигарет/день,, алкоголем не злоупотребляет  Профессиональные вредности: нет  Образ жизни: бытовые условия удовлетворительные; питание регулярное; гиподинамия  Перенесённые заболевания","Наследственность: у отца ИМ  Страховой анамнез: работает, б/л с 28.09.11  Аллергологический анамнез: не отмечал  Вредные привычки курит 10 лет по 2-3 сигарет/день,, алкоголем не злоупотребляет  Профессиональные вредности: нет  Образ жизни: бытовые условия удовлетворительные; питание регулярное; гиподинамия  Перенесённые заболевания",MedSpellChecker
Аллергологический анамнез  : без особенностей   Вредные привычки:  курение   Профессиональные вредности  отрицает   Образ жизни  : бытовые условия удовлетворительные; гиподинамия,Аллергологический анамнез  : без особенностей   Вредные привычки:  курение   Профессиональные вредности  отрицает   Образ жизни  : бытовые условия удовлетворительные; гиподинамия,MedSpellChecker
Хронические заболевания в анамнезе  : ГБ; ОАСНК,Хронические заболевания в анамнезе: ГБ; ОАСНК,MedSpellChecker
бронхиальная астма: в дестве до 12 лет,бронхиальная астма: в детстве до 12 лет,MedSpellChecker
"Перенесенные состояния:   операции Аппендэктомия: 1979    Хронические заболевания в анамнезе  : ГБ; стенокардия 2 ФК; МКБ: хронический пиелонефрит, ремиссия","Перенесённые состояния: операции: аппендэктомия: 1979. Хронические заболевания в анамнезе: ГБ; стенокардия 2 ФК; МКБ; хронический пиелонефрит, ремиссия",MedSpellChecker
"туберкулез, гепатит отрицает","туберкулёз, гепатит отрицает",MedSpellChecker
Хронические заболевания в анамнезе  : Ежегодно лечится от алкогольной зависимости - имплантация дисульфирама   Наследственность:  не отягощена   Страховой анамнез:  ; дата выдачи больничного листа 30.01.2013   Аллергологический анамнез  : без особенностей   Вредные привычки:  курение 1 пачка в день; алкоголь злоупотребление в анамнезе,Хронические заболевания в анамнезе: ежегодно лечится от алкогольной зависимости – имплантация дисульфирама. Наследственность:  не отягощена. Страховой анамнез: дата выдачи больничного листа 30.01.2013. Аллергологический анамнез: без особенностей. Вредные привычки: курение 1 пачка в день; алкоголь злоупотребление в анамнезе,MedSpellChecker
"Наследственность:  заболевания у родственников отец: умер в 51 год от заболевания легких?, мать: ОНМК в 81 год","Наследственность:  заболевания у родственников отец: умер в 51 год от заболевания лёгких?, мать: ОНМК в 81 год",MedSpellChecker
"спаечная болезнь, оперативное лечение 2007г., послеоперационная грыжа","спаечная болезнь, оперативное лечение 2007г., послеоперационная грыжа",MedSpellChecker
Каротидная эндатерэктомия слева в 2010г,Каротидная эндартерэктомия слева в 2010 г.,MedSpellChecker
Работал оператором на нефтеперерабатывающем оборудовании,Работал оператором на нефтеперерабатывающем оборудовании,MedSpellChecker
Хронические заболевания в анамнезе  : остеохондроз позвоночника; хроническая обструктивная болезнь легких    Наследственность:  не отягощена    Страховой анамнез:  работает; больничный лист нужен    Аллергологический анамнез  : без особенностей    Вредные привычки:  курение    Профессиональные вредности  отрицает    Образ жизни  : гиподинамия,Хронические заболевания в анамнезе: остеохондроз позвоночника; хроническая обструктивная болезнь лёгких. Наследственность: не отягощена. Страховой анамнез: работает; больничный лист нужен. Аллергологический анамнез: без особенностей. Вредные привычки:  курение. Профессиональные вредности отрицает. Образ жизни: гиподинамия,MedSpellChecker
"Женат, от брака имеет взрослую дочь, живет в семье","Женат, от брака имеет взрослую дочь, живёт в семье",MedSpellChecker
"Перенесенные состояния:  ОИМ 06.10, 07.10, ОНМК 10.10","Перенесённые состояния: ОИМ 06.10, 07.10, ОНМК 10.10",MedSpellChecker
"Хронические заболевания в анамнезе Хронический бронхит Наследственность: не отягощена Аллергологический анамнез: не отягощен Эпиданамнез: Гепатит, туберкулез, малярию, венерические заболевания -отрицает, За последние 6 месяцев за пределы РФ не выезжал Вредные привычки: курение бросил 20 лет назад; алкоголь редко","Хронические заболевания в анамнезе Хронический бронхит Наследственность: не отягощена Аллергологический анамнез: не отягощён Эпиданамнез: Гепатит, туберкулёз, малярию, венерические заболевания -отрицает, За последние 6 месяцев за пределы РФ не выезжал Вредные привычки: курение бросил 20 лет назад; алкоголь редко",MedSpellChecker
"заболевания, туберкулез-отрицает","заболевания, туберкулёз-отрицает",MedSpellChecker
Перенесенные состояния:  операции Аппендэктомия: 1965 г  Респираторные заболевания   Хронические заболевания в анамнезе  : ГБ; остеохондроз позвоночника   Гинекологический анамнез:  Роды: 1; Менопауза: с 50 лет   Наследственность:  не отягощена   Страховой анамнез:  не работает; инвалидность нет   Аллергологический анамнез  : без особенностей   Вредные привычки:  отрицает   Профессиональные вредности  отрицает   Образ жизни  : бытовые условия удовлетворительные; питание регулярное,Перенесённые состояния:  операции Аппендэктомия: 1965 г  Респираторные заболевания   Хронические заболевания в анамнезе  : ГБ; остеохондроз позвоночника   Гинекологический анамнез:  Роды: 1; Менопауза: с 50 лет   Наследственность:  не отягощена   Страховой анамнез:  не работает; инвалидность нет   Аллергологический анамнез  : без особенностей   Вредные привычки:  отрицает   Профессиональные вредности  отрицает   Образ жизни  : бытовые условия удовлетворительные; питание регулярное,MedSpellChecker
"Работает ген директором ООО ОП ""Элеон","Работает ген директором ООО ОП ""Элеон",MedSpellChecker
"01.06.14г - реостеосинтез грудины, вакуумное дренирование мягких тканей груди","01.06.14г - реостеосинтез грудины, вакуумное дренирование мягких тканей груди",MedSpellChecker
"Перелом правой лодыжки в 2009   Наследственность:  заболевания у родственников отец: ДКМП, ФП, гепатит В., мать: здорова, брат: здоров, двоюродный брат по отцовской линии - генетическое заболевание - аневризматическое поражение артериол","Перелом правой лодыжки в 2009   Наследственность:  заболевания у родственников отец: ДКМП, ФП, гепатит В., мать: здорова, брат: здоров, двоюродный брат по отцовской линии - генетическое заболевание - аневризматическое поражение артериол",MedSpellChecker
"ЧМТ, полостные операции отрицает","ЧМТ, полостные операции отрицает",MedSpellChecker
Образ жизни  : гиподинамия,Образ жизни  : гиподинамия,MedSpellChecker
Респираторные заболевания   Хронические заболевания в анамнезе  : ГБ; ИБС; стенокардия напряжения; облитерирующий атеросклероз артерий нижних конечностей; варикозная болезнь вен нижних конечностей; хроническая обструктивная болезнь легких; гастрит хронический; хронический пиелонефрит; Хр цистит,Респираторные заболевания. Хронические заболевания в анамнезе: ГБ; ИБС; стенокардия напряжения; облитерирующий атеросклероз артерий нижних конечностей; варикозная болезнь вен нижних конечностей; хроническая обструктивная болезнь лёгких; гастрит хронический; хронический пиелонефрит; хр. цистит,MedSpellChecker
Наследственность:  не отягощена    Страховой анамнез:  не работает; больничный лист не нужен    Аллергологический анамнез  : без особенностей    Вредные привычки:  курение с 13 лдет до 1997г по 2-3 п/д; алкоголь только по праздникам,Наследственность:  не отягощена    Страховой анамнез:  не работает; больничный лист не нужен    Аллергологический анамнез  : без особенностей    Вредные привычки:  курение с 13 лет до 1997г по 2-3 п/д; алкоголь только по праздникам,MedSpellChecker
Наследственность:  не отягощена   Страховой анамнез:  работает; больничный лист нет   Аллергологический анамнез  : без особенностей   Вредные привычки:  курение редко   Профессиональные вредности  : Нервно-психическое перенапряжение на работе   Образ жизни  : бытовые условия удовлетворительные; гиподинамия,Наследственность: не отягощена. Страховой анамнез: работает; больничный лист нет. Аллергологический анамнез: без особенностей. Вредные привычки: курение редко. Профессиональные вредности: нервно-психическое перенапряжение на работе. Образ жизни: бытовые условия удовлетворительные; гиподинамия,MedSpellChecker
Хронические заболевания в анамнезе  : хроническая обструктивная болезнь легких: хронический бронхит курильцика\; язвенная болезнь желудка вне обострения,Хронические заболевания в анамнезе  : хроническая обструктивная болезнь лёгких: хронический бронхит курильщика; язвенная болезнь желудка вне обострения,MedSpellChecker
С 1958 - проживает в г. Ленинграде,С 1958 - проживает в г. Ленинграде,MedSpellChecker
Хронические заболевания в анамнезе  : ГБ; ИБС; гастрит эрозивно антральный гастрит на ФГДС от 09.02.11   Аллергологический анамнез  : без особенностей   Вредные привычки:  курение более 1 пачки в день; алкоголь умеренно,Хронические заболевания в анамнезе: ГБ; ИБС; гастрит эрозивно-антральный гастрит на ФГДС от 09.02.11. Аллергологический анамнез: без особенностей. Вредные привычки: курение более 1 пачки в день; алкоголь умеренно,MedSpellChecker
"Вирусный гепатит, туберкулез, сахарный диабет, ОНМК в анамнезе отрицает","Вирусный гепатит, туберкулёз, сахарный диабет, ОНМК в анамнезе отрицает",MedSpellChecker
Менструальный цикл сохранён,Менструальный цикл сохранён,MedSpellChecker
"Аллергологический анамнез - аллергические реакции не отмечал Наследственность - не отягощена Вредные привычки - курит 55 лет по 1 пачке сигарет в день, алкоголем не злоупотребляет","Аллергологический анамнез - аллергические реакции не отмечал Наследственность - не отягощена Вредные привычки - курит 55 лет по 1 пачке сигарет в день, алкоголем не злоупотребляет",MedSpellChecker
"Условия труда  : по профессии учитель музыки, длительно не работает","Условия труда: по профессии учитель музыки, длительно не работает.",MedSpellChecker
остеохондроз позвоночника,остеохондроз позвоночника,MedSpellChecker
"не работает, пенсинер","не работает, пенсионер",MedSpellChecker
Хронические заболевания в анамнезе  : ГБ; остеохондроз позвоночника   Наследственность:  неизвестна   Страховой анамнез:  работает; больничный лист нет; нужен с 17.09.13 г.   Аллергологический анамнез  : без особенностей   Вредные привычки:  отрицает,Хронические заболевания в анамнезе : ГБ; остеохондроз позвоночника Наследственность: неизвестна Страховой анамнез: работает; больничный лист нет; нужен с 17.09.13 г. Аллергологический анамнез : без особенностей Вредные привычки: отрицает,MedSpellChecker
"Хронические заболевания в анамнезе  : МКБ, литоэкстракция 2001 г., разраыв брыжейки 2002 (ДТП","Хронические заболевания в анамнезе  : МКБ, литоэкстракция 2001 г., разрыв брыжейки 2002 (ДТП",MedSpellChecker
Родилась в Ульяновской области,Родилась в Ульяновской области,MedSpellChecker
"Перенесенные заболевания: хронический гастрит, ремиссия","Перенесённые заболевания: хронический гастрит, ремиссия",MedSpellChecker
"Хронические заболевания в анамнезе  : хронический гастрит, вне обострения","Хронические заболевания в анамнезе: хронический гастрит, вне обострения",MedSpellChecker
Хронические заболевания в анамнезе  : ГБ; ИБС; хроническая обструктивная болезнь легких; гастрит хронический; язвенная болезнь желудка ремиссия; ЖКБ; хронический холецистит    Наследственность:  не отягощена    Аллергологический анамнез  : без особенностей    Вредные привычки:  отрицает,"Хронические заболевания в анамнезе: ГБ; ИБС; хроническая обструктивная болезнь лёгких; гастрит хронический; язвенная болезнь желудка, ремиссия; ЖКБ; хронический холецистит. Наследственность: не отягощена. Аллергологический анамнез: без особенностей. Вредные привычки: отрицает.",MedSpellChecker
