source,correction,domain
"Наследственность:  не отягощена    Страховой анамнез:  работает; больничный лист нужен    Аллергологический анамнез  : без особенностей    Вредные привычки:  курение 1 пачка в день    Профессиональные вредности  : Контакт с инфекционными больными, инфицированными материалами или переносчиками болезней    Образ жизни  : бытовые условия удовлетворительные; питание регулярное, разнообразное","Наследственность:  не отягощена    Страховой анамнез:  работает; больничный лист нужен    Аллергологический анамнез  : без особенностей    Вредные привычки:  курение 1 пачка в день    Профессиональные вредности  : Контакт с инфекционными больными, инфицированными материалами или переносчиками болезней    Образ жизни  : бытовые условия удовлетворительные; питание регулярное, разнообразное",MedSpellChecker
"Заболевания легких, язвенную болезнь, СД, заболевания почек, травмы, операции отрицает","Заболевания лёгких, язвенную болезнь, СД, заболевания почек, травмы, операции отрицает",MedSpellChecker
"лейкоз, брат: ИМ   Страховой анамнез:  работает; больничный лист нет; дата выдачи больничного листа 19.04.2014; инвалидность нет   Аллергологический анамнез  : аллергия на: медикаменты амлодипин - отек лица   Вредные привычки:  курение редко по 1-3сигареты/неделю; алкоголь злоупотребление (через день крепкие алкогольн.напитки)   Образ жизни  : бытовые условия удовлетворительные; питание регулярное, разнообразное; гиподинамия","лейкоз; брат: ИМ. Страховой анамнез: работает; больничный лист - нет; дата выдачи больничного листа 19.04.2014; инвалидность - нет. Аллергологический анамнез: аллергия на: медикаменты амлодипин - отёк лица. Вредные привычки: курение - редко, по 1-3 сигареты / неделю; алкоголь - злоупотребление (через день крепкие алкогольн. напитки). Образ жизни: бытовые условия удовлетворительные; питание регулярное, разнообразное; гиподинамия.",MedSpellChecker
Курит в течение 30 лет по 10 сигаре в сутки,Курит в течение 30 лет по 10 сигарет в сутки,MedSpellChecker
"По фиброгастроскопии от 24.12.2010 выявлен поверхностный распространенный гастродуоденит, ремиссия","По фиброгастроскопии от 24.12.2010 выявлен поверхностный распространённый гастродуоденит, ремиссия",MedSpellChecker
"Заболевания почек, легких, печени в анамнезе отрицает","Заболевания почек, лёгких, печени в анамнезе отрицает",MedSpellChecker
Перенесенные состояния:  травмы черепно-мозговая травма: отрицает  операции: отрицает  Респираторные заболевания   Хронические заболевания в анамнезе  : ГБ; сахарный диабет 1 типа отрицает; гастрит отрицает; язвенная болезнь желудка отрицает   Наследственность:  заболевания у родственников мать: ГБ   Страховой анамнез:  работает; больничный лист нет   Аллергологический анамнез  : без особенностей   Вредные привычки:  курение 1 пачка в день; алкоголь умеренно   Условия труда  : удовл   Профессиональные вредности  отрицает   Образ жизни  : бытовые условия удовлетворительные; питание регулярное; занятие спортом: отрицает; гиподинамия,Перенесённые состояния: травмы: черепно-мозговая травма: отрицает; операции: отрицает. Респираторные заболевания. Хронические заболевания в анамнезе: ГБ; сахарный диабет 1 типа отрицает; гастрит отрицает; язвенная болезнь желудка - отрицает. Наследственность: заболевания у родственников: мать: ГБ. Страховой анамнез: работает; больничный лист: нет. Аллергологический анамнез: без особенностей. Вредные привычки: курение: 1 пачка в день; алкоголь: умеренно. Условия труда: удовл. Профессиональные вредности отрицает. Образ жизни: бытовые условия удовлетворительные; питание регулярное; занятие спортом: отрицает; гиподинамия,MedSpellChecker
Аллергологический анамнез   : не отягощен    Вредные привычки:  курение 1 пачка в день,Аллергологический анамнез: не отягощён. Вредные привычки: курение 1 пачка в день,MedSpellChecker
Хронические заболевания в анамнезе  : облитерирующий атеросклероз артерий нижних конечностей может пройти 20 метров без возникновения болей в ногах; хроническая обструктивная болезнь легких; бронхиальная астма; гастрит хронический   Наследственность:  заболевания у родственников мать: умерла от инфаркта   Аллергологический анамнез  : без особенностей   Вредные привычки:  курение более 1 пачки в день; алкоголь не пьет,"Хронические заболевания в анамнезе: облитерирующий атеросклероз артерий нижних конечностей, может пройти 20 метров без возникновения болей в ногах; хроническая обструктивная болезнь лёгких; бронхиальная астма; гастрит хронический. Наследственность: заболевания у родственников мать: умерла от инфаркта. Аллергологический анамнез: без особенностей. Вредные привычки: курение более 1 пачки в день; алкоголь не пьёт",MedSpellChecker
"В 2007 году струмектомия по поводу злокачественного новообразования щитовидной железы, в 2008 году - повторные операции в связи с рецидивом опухолевого процесса","В 2007 году струмэктомия по поводу злокачественного новообразования щитовидной железы, в 2008 году - повторные операции в связи с рецидивом опухолевого процесса",MedSpellChecker
Хронические заболевания в анамнезе  : ГБ; остеохондроз позвоночника; хроническая обструктивная болезнь легких   Наследственность:  заболевания у родственников мать: ИБС   Страховой анамнез:  работает; больничный лист нет; нужен с 23.05.2013   Аллергологический анамнез  : аллергия на: но-шпа (крапивница)   Вредные привычки:  курение более 1 пачки в день в течение 40 лет   Условия труда  : водитель большегрузной машины   Образ жизни  : гиподинамия,Хронические заболевания в анамнезе: ГБ; остеохондроз позвоночника; хроническая обструктивная болезнь лёгких. Наследственность: заболевания у родственников: мать: ИБС. Страховой анамнез: работает; больничный лист - нет; нужен с 23.05.2013. Аллергологический анамнез: аллергия на: но-шпа (крапивница). Вредные привычки: курение более 1 пачки в день в течение 40 лет. Условия труда: водитель большегрузной машины. Образ жизни: гиподинамия.,MedSpellChecker
"Хронические заболевания в анамнезе  : ГБ; остеохондроз позвоночника; гастрит хронический    Наследственность:  не отягощена    Страховой анамнез:  работает; больничный лист нет    Аллергологический анамнез  : без особенностей    Вредные привычки:  курение более 1 пачки в день; алкоголь в выходные дни    Профессиональные вредности  отрицает    Образ жизни  : бытовые условия удовлетворительные; питание регулярное, разнообразное; гиподинамия","Хронические заболевания в анамнезе  : ГБ; остеохондроз позвоночника; гастрит хронический    Наследственность:  не отягощена    Страховой анамнез:  работает; больничный лист нет    Аллергологический анамнез  : без особенностей    Вредные привычки:  курение более 1 пачки в день; алкоголь в выходные дни    Профессиональные вредности  отрицает    Образ жизни  : бытовые условия удовлетворительные; питание регулярное, разнообразное; гиподинамия",MedSpellChecker
Перенесенные состояния:   операции: 2008г,Перенесённые состояния:   операции: 2008г,MedSpellChecker
"ОНМК, язвенную болезнь, СД, заболевания печени, легких и почек отрицает","ОНМК, язвенную болезнь, СД, заболевания печени, лёгких и почек отрицает",MedSpellChecker
"Хронические заболевания в анамнезе: ГБ; ИБС; стенокардия напряжения; остеохондроз позвоночника; гастрит хронический; хронический бронхит Наследственность: заболевания у родственников мать: ГБ, ОНМК, курильщика Страховой анамнез: не работает; больничный лист нет Аллергологический анамнез: без особенностей Вредные привычки: курение более 1 пачки в день 40 лет, с 06.10- менее 1 пачки в день; алкоголь умеренно Профессиональные вредности отрицает Образ жизни: бытовые условия удовлетворительные; питание регулярное, разнообразное; гиподинамия","Хронические заболевания в анамнезе: ГБ; ИБС; стенокардия напряжения; остеохондроз позвоночника; гастрит хронический; хронический бронхит. Наследственность: заболевания у родственников: мать: ГБ, ОНМК, курильщика. Страховой анамнез: не работает; больничный лист: нет. Аллергологический анамнез: без особенностей. Вредные привычки: курение более 1 пачки в день 40 лет, с 06.10 - менее 1 пачки в день; алкоголь умеренно. Профессиональные вредности отрицает. Образ жизни: бытовые условия удовлетворительные; питание регулярное, разнообразное; гиподинамия",MedSpellChecker
"СД, Язвенную болезнь, заболевания легких отрицает","СД, Язвенную болезнь, заболевания легких отрицает",MedSpellChecker
Катаркта обоих глаз,Катаракта обоих глаз,MedSpellChecker
операци на крестообразных связках коленного сустава,операция на крестообразных связках коленного сустава,MedSpellChecker
"Хронические заболевания в анамнезе  : хроническая обструктивная болезнь легких; гастрит хронический   Наследственность:  не отягощена   Аллергологический анамнез  : без особенностей   Вредные привычки:  курение более 1 пачки в день в течение 30 лет, 1 год не курит; алкоголь в выходные дни   Условия труда  : удовлетворительные   Профессиональные вредности  отрицает","Хронические заболевания в анамнезе: хроническая обструктивная болезнь лёгких; гастрит хронический. Наследственность: не отягощена. Аллергологический анамнез: без особенностей. Вредные привычки: курение более 1 пачки в день в течение 30 лет, 1 год не курит; алкоголь в выходные дни. Условия труда: удовлетворительные. Профессиональные вредности отрицает",MedSpellChecker
"Хронические заболевания в анамнезе  : ГБ; ИБС; остеохондроз позвоночника; варикозная болезнь вен нижних конечностей; Киста правой почки    Гинекологический анамнез:  : миома матки, регресс Беременности: 3; Аборты: 1; Роды: 2; Выкидыши: 0; Менопауза: с 50 лет    Наследственность:  не отягощена    Страховой анамнез:  работает; б/л 10.09.14 продолжение    Аллергологический анамнез  : без особенностей    Вредные привычки:  отрицает    Условия труда  : уборщица    Профессиональные вредности  отрицает    Образ жизни  : бытовые условия: живет с мужем","Хронические заболевания в анамнезе  : ГБ; ИБС; остеохондроз позвоночника; варикозная болезнь вен нижних конечностей; Киста правой почки    Гинекологический анамнез:  : миома матки, регресс Беременности: 3; Аборты: 1; Роды: 2; Выкидыши: 0; Менопауза: с 50 лет    Наследственность:  не отягощена    Страховой анамнез:  работает; б/л 10.09.14 продолжение    Аллергологический анамнез  : без особенностей    Вредные привычки:  отрицает    Условия труда  : уборщица    Профессиональные вредности  отрицает    Образ жизни  : бытовые условия: живёт с мужем",MedSpellChecker
"Перенесенные состояния:  травмы черепно-мозговая травма, переломы: переломы носа  операции Аппендэктомия: 1974г","Перенесённые состояния:  травмы черепно-мозговая травма, переломы: переломы носа  операции Аппендэктомия: 1974г",MedSpellChecker
"На даннный момент не работает, пенсионер, инвалидности нет","На данный момент не работает, пенсионер, инвалидности нет",MedSpellChecker
Страховой анамнез:  ; больничный лист нет   Аллергологический анамнез  : без особенностей   Вредные привычки:  отрицает,Страховой анамнез:  ; больничный лист нет   Аллергологический анамнез  : без особенностей   Вредные привычки:  отрицает,MedSpellChecker
"Гинекологический анамнез:  Беременности: 6; Аборты: 4; Роды: 2; Менопауза: с 47 лет    Наследственность:  не отягощена    Страховой анамнез:  не работает: больничный лист не нужен      Аллергологический анамнез   : не отягощен      Эпиданамнез   : За последние 6 месяцев за пределы РФ не выезжал, туберкулез, малярию, венерические заболевания -отрицает, С: Гемотрансфузии: отрицает    Вредные привычки:  курение 1 пачка в день, стаж курения около 30 лет","Гинекологический анамнез: беременности: 6; аборты: 4; роды: 2; менопауза: с 47 лет. Наследственность: не отягощена. Страховой анамнез: не работает: больничный лист не нужен. Аллергологический анамнез: не отягощён. Эпиданамнез: за последние 6 месяцев за пределы РФ не выезжал, туберкулёз, малярию, венерические заболевания – отрицает, С: гемотрансфузии: отрицает. Вредные привычки: курение 1 пачка в день, стаж курения около 30 лет",MedSpellChecker
гастродуоденит.ГПОД   Гинекологический анамнез:  Менопауза: с 57 лет   Наследственность:  заболевания у родственников   Страховой анамнез:  работает; больничный лист нет   Аллергологический анамнез  : без особенностей   Вредные привычки:  отрицает,гастродуоденит. ГПОД. Гинекологический анамнез: менопауза: с 57 лет. Наследственность: заболевания у родственников. Страховой анамнез: работает; больничный лист нет. Аллергологический анамнез: без особенностей. Вредные привычки: отрицает,MedSpellChecker
"Туберкулёзом, маляриёй, гепатитом не болел, вененрические заболевания отрицает","Туберкулёзом, малярией, гепатитом не болел, венерические заболевания отрицает",MedSpellChecker
Перенесенные состояния:  операции:,Перенесённые состояния: операции:,MedSpellChecker
Объем назвать отказывается,Объём назвать отказывается,MedSpellChecker
Аппендэктомия (1974г,Аппендэктомия (1974 г.),MedSpellChecker
хронический пиелонефрит: вне обострения; Вентральная грыжа,хронический пиелонефрит: вне обострения; Вентральная грыжа,MedSpellChecker
Аллергологический анамнез - без особенностей,Аллергологический анамнез – без особенностей,MedSpellChecker
"2 детей (сын и дочь), взрослые, без заболеваний сердца","2 детей (сын и дочь), взрослые, без заболеваний сердца",MedSpellChecker
Хронические заболевания в анамнезе  : ГБ; ИБС; стенокардия нестабильная; гастрит; Пупочная грыжа,Хронические заболевания в анамнезе  : ГБ; ИБС; стенокардия нестабильная; гастрит; Пупочная грыжа,MedSpellChecker
"Страховой анамнез:  работает; больничный лист есть   Аллергологический анамнез  : аллергия на: пищевые продукты орехи, медикаменты левомицетин   Вредные привычки:  курение редко","Страховой анамнез: работает; больничный лист есть. Аллергологический анамнез: аллергия на: пищевые продукты орехи, медикаменты левомицетин. Вредные привычки: курение редко",MedSpellChecker
"Хронические заболевания в анамнезе  : туберкулез, мялирию, вирусные гепатиты в анамнезе отрицает","Хронические заболевания в анамнезе  : туберкулёз, малярию, вирусные гепатиты в анамнезе отрицает",MedSpellChecker
"Хронические заболевания в анамнезе  : туберкулез, гепатиты отрицает   Наследственность:  не отягощена   Страховой анамнез:  работает   Аллергологический анамнез  : без особенностей   Вредные привычки:  курение 1 пачка в день около 30 лет","Хронические заболевания в анамнезе: туберкулёз, гепатиты отрицает. Наследственность: не отягощена. Страховой анамнез: работает. Аллергологический анамнез: без особенностей. Вредные привычки:курение 1 пачка в день около 30 лет",MedSpellChecker
В последний год онколога не посещал,В последний год онколога не посещал,MedSpellChecker
Хронические заболевания в анамнезе  : гастрит хронический (со слов имеет место поллип,Хронические заболевания в анамнезе: гастрит хронический (со слов имеет место полип,MedSpellChecker
