source,correction,domain
"Хронические заболевания в анамнезе  : Сахарный диабет 2 типа, компенсирован, на фоне ССТ; Гастрит вне обострения; остеохондроз позвоночника: с вторичным болевым синдромом; варикозная болезнь вен нижних конечностей; хроническая обструктивная болезнь легких: Хронический бронхит, бронхиальная астма; МКБ хронический пиелонефрит; ЖКБ: хронический холецистит, хр","Хронические заболевания в анамнезе  : Сахарный диабет 2 типа, компенсирован, на фоне ССТ; Гастрит вне обострения; остеохондроз позвоночника: с вторичным болевым синдромом; варикозная болезнь вен нижних конечностей; хроническая обструктивная болезнь лёгких: Хронический бронхит, бронхиальная астма; МКБ хронический пиелонефрит; ЖКБ: хронический холецистит, хр",MedSpellChecker
"Плохо переносит - стероиды, метотрексат","Плохо переносит - стероиды, метотрексат",MedSpellChecker
"сахарный диабет, заболевания легких, печени, почек, язвенную болезнь, кровотечения в анамнезе отрицает","сахарный диабет, заболевания лёгких, печени, почек, язвенную болезнь, кровотечения в анамнезе отрицает",MedSpellChecker
"Туберкулез, гепатит В,С – отрицает","Туберкулёз, гепатит В, С – отрицает.",MedSpellChecker
Аллергологический анамнез   : не отягощен    Вредные привычки:  курение 1 пачка в день= 30 лет,Аллергологический анамнез   : не отягощён    Вредные привычки:  курение 1 пачка в день= 30 лет,MedSpellChecker
"Туберкулёзом, малярией не болел","Туберкулёзом, малярией не болел",MedSpellChecker
Работала преподавателем,Работала преподавателем,MedSpellChecker
Наследственность:  заболевания у родственников отец: умер от ОИМ      Аллергологический анамнез   : не отягощен    Образ жизни  : бытовые условия удовлетворительные; питание регулярное,Наследственность:  заболевания у родственников отец: умер от ОИМ      Аллергологический анамнез   : не отягощён    Образ жизни  : бытовые условия удовлетворительные; питание регулярное,MedSpellChecker
"Перенесенные состояния:  Плеврит с дренированием в 2001 году   Хронические заболевания в анамнезе  : ИБС   Наследственность:  заболевания у родственников мать: смерть от ИМ в возрасте 55 лет   Страховой анамнез:  работает; больничный лист нет; дата выдачи больничного листа 12.04.2013   Аллергологический анамнез  : аллергия на: пищевые продукты печень трески   Вредные привычки:  курение 1 пачка в день, стаж курения 13 лет   Профессиональные вредности  отрицает   Образ жизни  : бытовые условия удовлетворительные; питание регулярное","Перенесённые состояния: плеврит с дренированием в 2001 году. Хронические заболевания в анамнезе: ИБС. Наследственность: заболевания у родственников: мать: смерть от ИМ в возрасте 55 лет. Страховой анамнез: работает; больничный лист - нет; дата выдачи больничного листа 12.04.2013. Аллергологический анамнез: аллергия на: пищевые продукты - печень трески. Вредные привычки: курение 1 пачка в день, стаж курения 13 лет. Профессиональные вредности отрицает. Образ жизни: бытовые условия удовлетворительные; питание регулярное.",MedSpellChecker
Перенесенные состояния:  травмы переломы: голени - правой давно  операции: отрицает  Респираторные заболевания   Хронические заболевания в анамнезе  : ГБ; ИБС; стенокардия напряжения; облитерирующий атеросклероз артерий нижних конечностей; язвенная болезнь желудка ремиссия; хр Панкреатит,Перенесённые состояния:  травмы переломы: голени - правой давно  операции: отрицает  Респираторные заболевания   Хронические заболевания в анамнезе  : ГБ; ИБС; стенокардия напряжения; облитерирующий атеросклероз артерий нижних конечностей; язвенная болезнь желудка ремиссия; хр Панкреатит,MedSpellChecker
"На фоне проводимой терапии состояния больного улучшилось, регрессирована общемозговая симптоматика обусловленная отеком головного мозга, уменьшились проявления синдрома Дресслера","На фоне проводимой терапии состояния больного улучшилось, регрессирована общемозговая симптоматика обусловленная отёком головного мозга, уменьшились проявления синдрома Дресслера",MedSpellChecker
Тугоухость   Гинекологический анамнез:  Менопауза: 5 лет   Наследственность:  не отягощена   Страховой анамнез:  ; больничный лист нет   Аллергологический анамнез  : без особенностей   Вредные привычки:  отрицает   Образ жизни  : питание регулярное,Тугоухость   Гинекологический анамнез:  Менопауза: 5 лет   Наследственность:  не отягощена   Страховой анамнез:  ; больничный лист нет   Аллергологический анамнез  : без особенностей   Вредные привычки:  отрицает   Образ жизни  : питание регулярное,MedSpellChecker
"Туберкулез, гепатит – отрицает","Туберкулёз, гепатит – отрицает",MedSpellChecker
"заболевания легких, почек, кровотечения отрицает","заболевания лёгких, почек, кровотечения отрицает",MedSpellChecker
Перенесенные состояния:  травмы переломы: левой кисти в детстве,Перенесённые состояния: травмы переломы: левой кисти в детстве,MedSpellChecker
Перенесенные состояния:  операции Аппендэктомия: в юности   Хронические заболевания в анамнезе  : ГБ; ИБС: ПИКС 08.08.13; стенокардия напряжения и покоя; варикозная болезнь вен нижних конечностей флебэктомия больше 10 лет назад; гастрит хронический   Наследственность:  не отягощена   Аллергологический анамнез  : без особенностей   Вредные привычки:  отрицает   Профессиональные вредности  отрицает,"Перенесённые состояния: операции: аппендэктомия: в юности. Хронические заболевания в анамнезе: ГБ; ИБС: ПИКС 08.08.13; стенокардия напряжения и покоя; варикозная болезнь вен нижних конечностей, флебэктомия больше 10 лет назад; гастрит хронический. Наследственность: не отягощена. Аллергологический анамнез: без особенностей. Вредные привычки: отрицает. Профессиональные вредности: отрицает",MedSpellChecker
Хронические заболевания в анамнезе  : ГБ; ИБС; стенокардия напряжения; хроническая обструктивная болезнь легких; хронический пиелонефрит: вне обострения,Хронические заболевания в анамнезе: ГБ; ИБС; стенокардия напряжения; хроническая обструктивная болезнь лёгких; хронический пиелонефрит: вне обострения,MedSpellChecker
Аллергологический анамнез - споокйный,Аллергологический анамнез - спокойный,MedSpellChecker
варикозная болезнь вен нижних конечностей; 1994г,варикозная болезнь вен нижних конечностей; 1994 г.,MedSpellChecker
"Хронические заболевания в анамнезе  : ГБ    Наследственность:  не отягощена    Страховой анамнез:  работает; больничный лист нужен; дата выдачи больничного листа 30.10.2015    Аллергологический анамнез  : аллергия на: медикаменты новокаин: Рвота, головокружение    Вредные привычки:  курение более 1 пачки в день 25 лет, не курит с 2002г","Хронические заболевания в анамнезе: ГБ   Наследственность:  не отягощена    Страховой анамнез:  работает; больничный лист нужен; дата выдачи больничного листа 30.10.2015    Аллергологический анамнез  : аллергия на: медикаменты новокаин: Рвота, головокружение    Вредные привычки:  курение более 1 пачки в день 25 лет, не курит с 2002 г",MedSpellChecker
Хронические заболевания в анамнезе  : ГБ; хроническая обструктивная болезнь легких: хронический бронхит курильщика; гастрит хронический   Аллергологический анамнез  : без особенностей   Вредные привычки:  курение 1 пачка в день,Хронические заболевания в анамнезе  : ГБ; хроническая обструктивная болезнь лёгких: хронический бронхит курильщика; гастрит хронический   Аллергологический анамнез  : без особенностей   Вредные привычки:  курение 1 пачка в день,MedSpellChecker
Хронические заболевания в анамнезе  : Проникающее ножевое ранение живота 20 лет назад,Хронические заболевания в анамнезе  : Проникающее ножевое ранение живота 20 лет назад,MedSpellChecker
"Хронические заболевания в анамнезе  : ГБ    Наследственность:  заболевания у родственников отец: ГБ    Страховой анамнез:  ; больничный лист нужен; дата выдачи больничного листа 11.04.2015    Аллергологический анамнез  : аллергия на: бытовые аллергены книжная пыль, на шерсть кошек    Вредные привычки:  отрицает    Образ жизни  : занятие спортом","Хронические заболевания в анамнезе  : ГБ    Наследственность:  заболевания у родственников отец: ГБ    Страховой анамнез:  ; больничный лист нужен; дата выдачи больничного листа 11.04.2015    Аллергологический анамнез  : аллергия на: бытовые аллергены книжная пыль, на шерсть кошек    Вредные привычки:  отрицает    Образ жизни  : занятие спортом",MedSpellChecker
"Гепатит, туберкулез, венерические заболевания отрицает","Гепатит, туберкулёз, венерические заболевания отрицает",MedSpellChecker
Вредные привычки:  отрицает; алкоголь только по праздникам   Профессиональные вредности  отрицает   Образ жизни  : гиподинамия,Вредные привычки: отрицает; алкоголь только по праздникам. Профессиональные вредности  отрицает. Образ жизни: гиподинамия,MedSpellChecker
Живет в квартире с женой,Живёт в квартире с женой,MedSpellChecker
Страховой анамнез:  работает; больничный лист нет; дата выдачи больничного листа 15.10.2010   Аллергологический анамнез  : без особенностей,Страховой анамнез:  работает; больничный лист нет; дата выдачи больничного листа 15.10.2010   Аллергологический анамнез  : без особенностей,MedSpellChecker
Страховой анамнез:  работает; больничный лист нет; б/л нужен с 02.08.2010г,Страховой анамнез: работает; больничный лист - нет; б/л нужен с 02.08.2010 г.,MedSpellChecker
защита; наркотические/психотропные: отрицает,защита; наркотические/психотропные: отрицает,MedSpellChecker
"Хронические заболевания в анамнезе  : СД, БА, ЯБ, туберкулез, гепатит, желтуху отрицает","Хронические заболевания в анамнезе: СД, БА, ЯБ, туберкулёз, гепатит, желтуху отрицает",MedSpellChecker
Вредные привычки:  курение   Образ жизни  : бытовые условия удовлетворительные; питание регулярное,Вредные привычки:  курение   Образ жизни  : бытовые условия удовлетворительные; питание регулярное,MedSpellChecker
"Хронические заболевания в анамнезе  : Меланома кожи ягодиц, комбинированное лечение (хирургическое, ПХТ) 2005 г. Теберкулема верхушки левого легкого, резекция верхушки левого легкого 1979 г. Язвенная болезнь ДПК, ремиссия    Страховой анамнез:  не работает    Аллергологический анамнез  : без особенностей    Вредные привычки:  отрицает","Хронические заболевания в анамнезе: меланома кожи ягодиц, комбинированное лечение (хирургическое, ПХТ) 2005 г.; туберкулёма верхушки левого лёгкого, резекция верхушки левого лёгкого 1979 г.; язвенная болезнь ДПК, ремиссия. Страховой анамнез: не работает. Аллергологический анамнез: без особенностей. Вредные привычки: отрицает.",MedSpellChecker
Постинфекционный гепатит В. Данных за хроинческий вирусный гепатит В нет,Постинфекционный гепатит В. Данных за хронический вирусный гепатит В нет,MedSpellChecker
"Перенесенные состояния:  операции: ушивание прободной язвы желудка 1980 г  Респираторные заболевания   Хронические заболевания в анамнезе  : ГБ; ИБС; язвенная болезнь желудка ремиссия   Наследственность:  заболевания у родственников отец: ГБ, мать: ГБ, брат: СД   Страховой анамнез:  не работает; больничный лист нет; инвалидность нет   Аллергологический анамнез  : без особенностей   Вредные привычки:  курение 1 пачка в день до 01.03.12, бросил алкоголь только по праздникам   Условия труда  : работал на заводе","Перенесённые состояния:  операции: ушивание прободной язвы желудка 1980 г  Респираторные заболевания   Хронические заболевания в анамнезе  : ГБ; ИБС; язвенная болезнь желудка ремиссия   Наследственность:  заболевания у родственников отец: ГБ, мать: ГБ, брат: СД   Страховой анамнез:  не работает; больничный лист нет; инвалидность нет   Аллергологический анамнез  : без особенностей   Вредные привычки:  курение 1 пачка в день до 01.03.12, бросил алкоголь только по праздникам   Условия труда  : работал на заводе",MedSpellChecker
наследственность по ССЗ отягощена6 отец - умер в 62 года от ИМ,наследственность по ССЗ отягощена: отец - умер в 62 года от ИМ,MedSpellChecker
"Перенесенные состояния:  травмы черепно-мозговая травма: ЗЧМТ, переломы: травматические многократные перелдомы верхних конечностей","Перенесённые состояния:  травмы черепно-мозговая травма: ЗЧМТ, переломы: травматические многократные переломы верхних конечностей",MedSpellChecker
ремиссии   Страховой анамнез:  работает   Аллергологический анамнез  : без особенностей   Вредные привычки:  курение более 1 пачки в день   Образ жизни  : гиподинамия,ремиссии   Страховой анамнез:  работает   Аллергологический анамнез  : без особенностей   Вредные привычки:  курение более 1 пачки в день   Образ жизни  : гиподинамия,MedSpellChecker
Перенесенные состояния:  операции: по поводу парапроктита в 2002г,Перенесённые состояния:  операции: по поводу парапроктита в 2002г,MedSpellChecker
Хронические заболевания в анамнезе  : ГБ; ИБС; хроническая обструктивная болезнь легких    Наследственность:  не отягощена    Страховой анамнез:  не работает    Аллергологический анамнез  : без особенностей    Вредные привычки:  курение более 1 пачки в день    Образ жизни  : Водитель,Хронические заболевания в анамнезе : ГБ; ИБС; хроническая обструктивная болезнь лёгких Наследственность: не отягощена Страховой анамнез: не работает Аллергологический анамнез : без особенностей Вредные привычки: курение более 1 пачки в день Образ жизни : Водитель,MedSpellChecker
"Наследственность:  не отягощена   Страховой анамнез:  работает; больничный лист нет   Аллергологический анамнез  : без особенностей   Вредные привычки:  алкоголь умеренно   Профессиональные вредности  отрицает   Образ жизни  : бытовые условия удовлетворительные; питание регулярное, разнообразное; гиподинамия","Наследственность:  не отягощена   Страховой анамнез:  работает; больничный лист нет   Аллергологический анамнез  : без особенностей   Вредные привычки:  алкоголь умеренно   Профессиональные вредности  отрицает   Образ жизни  : бытовые условия удовлетворительные; питание регулярное, разнообразное; гиподинамия",MedSpellChecker
Хронические заболевания в анамнезе  : язвенная болезнь двенадцатиперстной кишки ремиссия    Наследственность:  не отягощена    Страховой анамнез:  не работает    Аллергологический анамнез  : без особенностей    Вредные привычки:  курение бросил в  2014 г; алкоголь умеренно,"Хронические заболевания в анамнезе: язвенная болезнь двенадцатиперстной кишки, ремиссия. Наследственность: не отягощена. Страховой анамнез: не работает. Аллергологический анамнез: без особенностей. Вредные привычки: курение бросил в 2014 г.; алкоголь умеренно",MedSpellChecker
Наследственность:  неизвестна    Страховой анамнез:  работает; дата выдачи больничного листа 23.11.2015    Аллергологический анамнез  : без особенностей    Вредные привычки:  курение,Наследственность:  неизвестна    Страховой анамнез:  работает; дата выдачи больничного листа 23.11.2015    Аллергологический анамнез  : без особенностей    Вредные привычки:  курение,MedSpellChecker
